Titulo Principal,Titulo Secundario,Autor,N° Ref
Reflections; or Sentences and Moral Maxims,,François duc de La Rochefoucauld,511
Letters of Abelard and Heloise,,Peter Abelard and Héloïse,511
American Notes,,Charles Dickens,508
Pragmatism: A New Name for Some Old Ways of Thinking,,William James,508
Laura Middleton; Her Brother and her Lover,,Anonymous,506
Les liaisons dangereuses,,Choderlos de Laclos,506
The Canterville Ghost,,Oscar Wilde,505
Dracula's Guest,,Bram Stoker,504
Kim,,Rudyard Kipling,504
The Practice and Science of Drawing,,Harold Speed,504
Twice-told tales,,Nathaniel Hawthorne,502
The Crucible,,Mark Lee Luther,502
Spoon River Anthology,,Edgar Lee Masters,501
Dialogues Concerning Natural Religion,,David Hume,501
Flatland: A Romance of Many Dimensions,,Edwin Abbott Abbott,501
Lady Audley's Secret,,M. E.  Braddon,501
Kidnapped,,Robert Louis Stevenson,500
"Poems on various subjects, religious and moral",,Phillis Wheatley,499
De Officiis,,Marcus Tullius Cicero,498
The Blue Fairy Book,,Andrew Lang,497
Gargantua and Pantagruel,,François Rabelais,496
Roughing It,,Mark Twain,496
"The Oera Linda Book, from a Manuscript of the Thirteenth Century",,,496
Biographia Literaria,,Samuel Taylor Coleridge,496
The Anatomy of Melancholy,,Robert Burton,496
The Arabian Nights Entertainments,,Andrew Lang,494
The Romance of Tristan and Iseult,,Joseph Bédier,494
The Old Curiosity Shop,,Charles Dickens,494
El libro de las mil noches y una noche; t. 1,,Anonymous,494
The Scarlet Letter,,Nathaniel Hawthorne,493
Essays of Schopenhauer,,Arthur Schopenhauer,492
Politics: A Treatise on Government,,Aristotle,492
"Apology, Crito, and Phaedo of Socrates",,Plato,491
The Scarlet Pimpernel,,Baroness Emmuska Orczy Orczy,490
A General History of the Pyrates:,,Daniel Defoe,489
The Hanging Stranger,,Philip K. Dick,488
The Sea-Wolf,,Jack London,488
"The Jargon File, Version 4.2.2, 20 Aug 2000",,,488
Mrs. Warren's Profession,,Bernard Shaw,487
"Ang Liham ni Dr. Jose Rizal sa mga Kadalagahan sa Malolos, Bulakan",,José Rizal,487
Poems,,Victor Hugo,486
The Iliad of Homer,,Homer,485
Discours de la méthode,,René Descartes,485
The Box-Car Children,,Gertrude Chandler Warner,484
Saint Dominique,,Jean Guiraud,484
Pride and Prejudice,,Jane Austen,484
The Way of the World,,William Congreve,483
The Sketch-Book of Geoffrey Crayon,,Washington Irving,481
Lord Jim,,Joseph Conrad,480
The Princess and the Goblin,,George MacDonald,479
Thought-Forms,,Annie Besant and C. W.  Leadbeater,479
Martin Eden,,Jack London,479
Cuentos de Amor de Locura y de Muerte,,Horacio Quiroga,478
"Plutarch's Lives, Volume 1",,Plutarch,478
The Diary of Samuel Pepys — Complete,,Samuel Pepys,477
Sister Carrie: A Novel,,Theodore Dreiser,475
The Essays of Arthur Schopenhauer; Studies in Pessimism,,Arthur Schopenhauer,474
Белые ночи,,Fyodor Dostoyevsky,473
Dead Souls,,Nikolai Vasilevich Gogol,473
Japanese Girls and Women,,Alice Mabel Bacon,473
The Discoverie of Witchcraft,,Reginald Scot,473
The Moonstone,,Wilkie Collins,472
Nicholas Nickleby,,by Charles Dickens,472
"The Forsyte Saga, Volume I.",,John Galsworthy,472
Sons and Lovers,,D. H.  Lawrence,470
A Hundred and Seventy Chinese Poems,,,470
The Egyptian Book of the dead,,,470
The Wonderful Wizard of Oz,,L. Frank  Baum,470
Beautiful Stories from Shakespeare,,E.  Nesbit and William Shakespeare,469
An Account of Egypt,,Herodotus,468
"A Biblia Sagrada, Contendo o Velho e o Novo Testamento",,,468
The Story of My Life,,Helen Keller,468
"Proverbes sur les femmes, l'amitié, l'amour et le mariage",,P.-M.  Quitard,468
A Discourse Upon the Origin and the Foundation of the Inequality Among Mankind,,Rousseau,467
The Anglo-Egyptian Sudan: a compendium prepared,,"officers of the Sudan government, Vol. 1",467
Soeur Thérèse de l'Enfant-Jésus et de la Sainte Face,,Saint de Lisieux Thérèse,466
A Classification and Subject Index for Cataloguing and Arranging the Books and Pamphlets of a Librar,,,465
Emile,,Jean-Jacques Rousseau,465
On the Sublime,,active 1st century Longinus,463
The mystery of the Blue Train,,Agatha Christie,462
The Golden Bough: A Study of Magic and Religion,,James George Frazer,462
The Nibelungenlied,,,462
Etiquette,,Emily Post,460
Daemonologie.,,King of England James I,459
"The Country of the Blind, and Other Stories",,H. G.  Wells,458
The Playboy of the Western World: A Comedy in Three Acts,,J. M.  Synge,458
The Gentlemen's Book of Etiquette and Manual of Politeness,,Cecil B. Hartley,458
An Ideal Husband,,Oscar Wilde,458
Encyclopedia of Needlework,,Thérèse de Dillmont,458
Tarzan of the Apes,,Edgar Rice Burroughs,456
"The Bible, Douay-Rheims, Complete",,,456
The Story of the Volsungs,,,456
Poems and Songs of Robert Burns,,Robert Burns,455
The Tale of Genji,,Murasaki Shikibu,453
Filipino Popular Tales,,,452
The Man in the Brown Suit,,Agatha Christie,452
The Secret Garden,,Frances Hodgson Burnett,452
The Poems of Sappho: An Interpretative Rendition into English,,Sappho,452
The Moon and Sixpence,,W. Somerset  Maugham,449
Canada West,,,448
The Man Who Was Thursday: A Nightmare,,G. K.  Chesterton,448
An Enquiry Concerning the Principles of Morals,,David Hume,447
El arte de amar,,Ovid,447
The Letters of Wolfgang Amadeus Mozart — Volume 01,,Wolfgang Amadeus Mozart,447
The American Frugal Housewife,,Lydia Maria Child,446
Laws,,Plato,446
Short Stories,,Fyodor Dostoyevsky,446
The Essays of Arthur Schopenhauer: the Wisdom of Life,,Arthur Schopenhauer,446
Alice's Adventures in Wonderland,,Lewis Carroll,446
The Raven,,Edgar Allan Poe,444
The Origin of Species,,Means of Natural Selection by Charles Darwin,444
The Legends of King Arthur and His Knights,,Sir James Knowles and Sir Thomas Malory,443
A Child's Garden of Verses,,Robert Louis Stevenson,442
El árbol de la ciencia: novela,,Pío Baroja,442
The Art of War,,active 6th century B.C. Sunzi,441
The Pilgrim's Progress,,John Bunyan Every Child Can Read by John Bunyan,438
The Jew of Malta,,Christopher Marlowe,437
El crimen y el castigo,,Fyodor Dostoyevsky,436
Martin Chuzzlewit,,Charles Dickens,436
Bradford's History of 'Plimoth Plantation',,William Bradford,435
The Mill on the Floss,,George Eliot,434
English-Esperanto Dictionary,,C. F.  Hayes and J. C.  O'Connor,434
Plays,,"Anton Chekhov, Second Series by Anton Pavlovich Chekhov",433
"The Younger Edda; Also called Snorre's Edda, or The Prose Edda",,Snorri Sturluson,433
Meno,,Plato,433
A Tramp Abroad,,Mark Twain,432
Erewhon,Over the Range,Samuel Butler,431
The Best American Humorous Short Stories,,,428
Daisy Miller: A Study,,Henry James,428
French Conversation and Composition,,Harry Vincent Wann,428
Aeneidos,,Virgil,427
Second Variety,,Philip K. Dick,426
中國十大禁書之國色天香,,active 16th century Jingsuo Wu,424
Mrs. Spring Fragrance,,Sui Sin Far,424
Kalevala : the Epic Poem of Finland — Complete,,,424
The Germany and the Agricola of Tacitus,,Cornelius Tacitus,423
Fifty Famous Stories Retold,,James Baldwin,423
Le rouge et le noir: chronique du XIXe siècle,,Stendhal,422
Shakespeare's Sonnets,,William Shakespeare,422
The School for Scandal,,Richard Brinsley Sheridan,421
The Meditations of the Emperor Marcus Aurelius Antoninus,,Emperor of Rome Marcus Aurelius,420
Psychology of the Unconscious,,C. G.  Jung,420
The Anglo-Egyptian Sudan: a compendium prepared,,"officers of the Sudan government, Vol. 2",419
Miscellaneous Writings and Speeches — Volume 4,,Baron Thomas Babington Macaulay Macaulay,418
The First Six Books of the Elements of Euclid,,John Casey and Euclid,418
"The History of Don Quixote, Volume 2, Complete",,Miguel de Cervantes Saavedra,417
A Japanese Boy,,Shigemi Shiukichi,415
A Plea for Captain John Brown,,Henry David Thoreau,414
English Fairy Tales,,,414
Plays of Sophocles: Oedipus the King; Oedipus at Colonus; Antigone,,Sophocles,411
Justice,,John Galsworthy,410
Духовные оды,,Gavriil Romanovich Derzhavin,410
The Complete Poetical Works of Edgar Allan Poe,,Edgar Allan Poe,410
"The Best of the World's Classics, Restricted to Prose, Vol. X",,,409
Confessions of an English Opium-Eater,,Thomas De Quincey,408
Der Zauberberg. Erster Band,,Thomas Mann,408
The innocence of Father Brown,,G. K.  Chesterton,408
Three Ghost Stories,,Charles Dickens,407
Tamburlaine the Great — Part 1,,Christopher Marlowe,406
Demonology and Devil-lore,,Moncure Daniel Conway,406
Charlotte Temple,,Mrs. Rowson,406
A Princess of Mars,,Edgar Rice Burroughs,405
Commentary on the Epistle to the Galatians,,Martin Luther,405
"The Works of the Right Honourable Edmund Burke, Vol. 01",,Edmund Burke,405
A Concise Anglo-Saxon Dictionary,,J. R. Clark  Hall,405
Entretiens / Interviews / Entrevistas,,Marie Lebert,405
Daddy-Long-Legs,,Jean Webster,404
Cane,,Jean Toomer,404
"The Works of Edgar Allan Poe, The Raven Edition",,Edgar Allan Poe,403
Latin for Beginners,,Benjamin L.  D'Ooge,402
Protagoras,,Plato,402
The slang dictionary :,,John Camden Hotten,401
The Rubaiyat of Omar Khayyam,,Omar Khayyam,400
The Practice of the Presence of God,,Brother of the Resurrection Lawrence,399
Zimmerblattpflanzen,,Udo Dammer,399
Anne's House of Dreams,,L. M.  Montgomery,399
The Frontier in American History,,Frederick Jackson Turner,399
"The Influence of Sea Power Upon History, 1660-1783",,A. T.  Mahan,399
The Travels of Sir John Mandeville,,Sir John Mandeville,398
Spoon River Anthology,,Edgar Lee Masters,397
The Essays of Arthur Schopenhauer; Counsels and Maxims,,Arthur Schopenhauer,397
Volpone,The Fox,Ben Jonson,396
What to draw and how to draw it,,Edwin George Lutz,395
Arms and the Man,,Bernard Shaw,395
Plutarch's Morals,,Plutarch,394
Marmion: A Tale Of Flodden Field,,Walter Scott,393
The Science of Getting Rich,,W. D. Wattles,392
"The City of God, Volume II",,Bishop of Hippo Saint Augustine,392
Far from the Madding Crowd,,Thomas Hardy,391
Folk-Tales of Bengal,,Lal Behari Day,391
Sir Gawain and the Green Knight: A Middle-English Arthurian Romance Retold in Modern Prose,,Weston,391
Theaetetus,,Plato,391
The Life of Lazarillo de Tormes,,Anonymous,390
The Tale of Squirrel Nutkin,,Beatrix Potter,390
The Battle of the Bays,,Owen Seaman,390
The Critique of Practical Reason,,Immanuel Kant,389
Howards End,,E. M.  Forster,389
Cicero's Tusculan Disputations,,Marcus Tullius Cicero,388
What Is Art?,,graf Leo Tolstoy,386
Japanese Fairy Tales,,Yei Theodora Ozaki,385
二刻拍案惊奇,,Mengchu Ling,385
Autobiography of a Yogi,,Paramahansa Yogananda,385
The Joyful Wisdom,,Friedrich Wilhelm Nietzsche,385
The Tenant of Wildfell Hall,,Anne Brontë,385
L'île mystérieuse,,Jules Verne,384
Considerations on Representative Government,,John Stuart Mill,383
Woodworking Tools 1600-1900,,Peter C. Welsh,383
"The System of Nature, or, the Laws of the Moral and Physical World. Volume 1",,Holbach,382
The Prince,,Niccolò Machiavelli,382
Relativity : the Special and General Theory,,Albert Einstein,382
"Ars Amatoria; or, The Art Of Love",,Ovid,381
Palmistry for All,,Cheiro,381
Master and Man,,graf Leo Tolstoy,381
Contes Français,,,381
Orthodoxy,,G. K.  Chesterton,380
Five Selected Short Stories,,D. H.  Lawrence,380
Principios e questões de philosophia politica,,António Cândido,379
Eugene Oneguine [Onegin],,Aleksandr Sergeevich Pushkin,379
Life in the Iron-Mills,The Korl Woman,Rebecca Harding Davis,377
"Hesiod, the Homeric Hymns, and Homerica",,Hesiod,377
Half a Man: The Status of the Negro in New York,,Mary White Ovington,377
On the Nature of Things,,Titus Lucretius Carus,377
Ancient Monuments of the Mississippi Valley,,E. H.  Davis and E. G.  Squier,376
The Secret Agent: A Simple Tale,,Joseph Conrad,376
Little Lucy's Wonderful Globe,,Charlotte M.  Yonge,376
Minute Mysteries [Detectograms],,H. A.  Ripley,376
Modern Spanish Lyrics,,,376
"Nil Darpan; or, The Indigo Planting Mirror, A Drama.",,Dinabandhu Mitra,375
The Narrative of Arthur Gordon Pym of Nantucket,,Edgar Allan Poe,375
A General Introduction to Psychoanalysis,,Sigmund Freud,373
"The Bet, and other stories",,Anton Pavlovich Chekhov,373
The Ladies Delight,,Anonymous,372
Cyropaedia: The Education of Cyrus,,Xenophon,372
The Analects of Confucius,,Confucius,372
Simple Sabotage Field Manual,,United States. Office of Strategic Services,372
The Hairy Ape,,Eugene O'Neill,372
Novelas Cortas,,Pedro Antonio de Alarcón,370
A Complete Guide to Heraldry,,Arthur Charles Fox-Davies,370
Every Man in His Humor,,Ben Jonson,370
Sartor Resartus: The Life and Opinions of Herr Teufelsdröckh,,Thomas Carlyle,370
Sonnets from the Portuguese,,Elizabeth Barrett Browning,370
The Gambler,,Fyodor Dostoyevsky,369
The Portrait of a Lady — Volume 1,,Henry James,368
The case-book of Sherlock Holmes,,Arthur Conan Doyle,368
The Institutes of Justinian,,,368
The Open Boat and Other Stories,,Stephen Crane,367
Dombey and Son,,Charles Dickens,367
The House of the Seven Gables,,Nathaniel Hawthorne,367
The Mysterious Island,,Jules Verne,366
Voyage au Centre de la Terre,,Jules Verne,365
All About Coffee,,William H.  Ukers,364
Diccionario Bagobo-Español,,Mateo Gisbert,364
苦悶の欄,,Earl Derr Biggers,364
Faust: Eine Tragödie [erster Teil],,Johann Wolfgang von Goethe,363
Heimskringla,The Chronicle of the Kings of Norway,Snorri Sturluson,363
Strange Stories from a Chinese Studio,,Songling Pu,363
"Rasselas, Prince of Abyssinia",,Samuel Johnson,363
Dom Casmurro,,Machado de Assis,363
Twenty Thousand Leagues Under the Seas: An Underwater Tour of the World,,Jules Verne,362
"The Works of Guy de Maupassant, Vol. 1",,Guy de Maupassant,362
Checklist,,,362
Northern Nut Growers Association Report of the Proceedings at the 44th Annual Meeting,,,362
Don Juan Tenorio,,José Zorrilla,362
Pag Susulatan nang Dalauang Binibini na si Urbana at ni Feliza,,Modesto  de Castro,361
"The Spectator, Volume 1",,Joseph Addison and Sir Richard Steele,361
The Agamemnon of Aeschylus,,Aeschylus,358
Os Maias: episodios da vida romantica,,Eça de Queirós,358
The Shame of the Cities,,Lincoln Steffens,357
The Real Mother Goose,,,357
"Rockets, Missiles, and Spacecraft of the National Air and Space Museum, Smithsonian Institution",,,357
Essais de Montaigne,,Michel de Montaigne,357
The Suppression of the African Slave Trade to the United States of America,,W. E. B.  Du Bois,356
"The Principles of Psychology, Volume 1",,William James,356
"Joseph Andrews, Vol. 1",,Henry Fielding,355
Kwaidan: Stories and Studies of Strange Things,,Lafcadio Hearn,355
Grimm's Fairy Tales,,Jacob Grimm and Wilhelm Grimm,354
English Synonyms and Antonyms,,James Champlin Fernald,353
海公案,,Anonymous,353
The Woman in Black,,E. C.  Bentley,353
肉蒲團,,Yu Li,352
Timaeus,,Plato,352
English Literature,,William J.  Long,351
"De Re Metallica, Translated from the First Latin Edition of 1556",,Georg Agricola,351
Ion,,Plato,350
Heath's Modern Language Series: The Spanish American Reader,,Ernesto Nelson,350
I. Beowulf: an Anglo-Saxon poem. II. The fight at Finnsburh: a fragment.,,,350
"Commentaries on the Laws of England, Book the First",,Sir William Blackstone,349
"Right Ho, Jeeves",,P. G.  Wodehouse,349
Villette,,Charlotte Brontë,348
The Lifted Veil,,George Eliot,348
"Hung Lou Meng, or, the Dream of the Red Chamber, a Chinese Novel, Book I",,Xueqin Cao,348
Mark Twain's Speeches,,Mark Twain,348
Scouting for Boys,,Baron Robert Stephenson Smyth Baden-Powell Baden-Powell of Gilwell,347
La Comédie humaine - Volume 02,,Honoré de Balzac,346
"Principles of Orchestration, with Musical Examples Drawn from His Own Works",,Rimsky-Korsakov,345
The Apostolic Tradition of Hippolytus,,Antipope Hippolytus,345
The Rainbow,,D. H.  Lawrence,345
A Prose English Translation of Harivamsha,,,345
Principles of Political Economy,,John Stuart Mill,344
The Nursery Rhymes of England,,,344
Grimm's Fairy Stories,,Jacob Grimm and Wilhelm Grimm,343
The Post Office,,Rabindranath Tagore,343
The Secret Sharer,,Joseph Conrad,343
The International Jew : The World's Foremost Problem,,Anonymous,342
"The Spectator, Volumes 1, 2 and 3",,Joseph Addison and Sir Richard Steele,341
The Big Four,,Agatha Christie,341
One Hundred Proofs That the Earth Is Not a Globe,,William Carpenter,340
Lady Chatterley's lover,,D. H.  Lawrence,340
"Encyclopaedia Britannica, 11th Edition, ""Destructors"" to ""Diameter""",,Various,339
Myths and Legends of China,,E. T. C.  Werner,338
Boy Scouts Handbook,,Boy Scouts of America,338
Prayers of the Early Church,,,338
The Marching Morons,,C. M.  Kornbluth,338
"The Queen of Spades, and other stories",,Aleksandr Sergeevich Pushkin,337
Lays of Ancient Rome,,Baron Thomas Babington Macaulay Macaulay,337
Детство,,graf Leo Tolstoy,337
Give Me Liberty or Give Me Death,,Patrick Henry,337
The Book of the Thousand Nights and a Night — Volume 01,,,337
The Lost World,,Arthur Conan Doyle,336
The house at Pooh Corner,,A. A.  Milne,336
"Eve's Diary, Complete",,Mark Twain,335
The American Occupation of the Philippines 1898-1912,,James H.  Blount,335
Sketches New and Old,,Mark Twain,335
"The Battle of the Books, and other Short Pieces",,Jonathan Swift,334
The Orbis Pictus,,Johann Amos Comenius,334
What's Wrong with the World,,G. K.  Chesterton,333
The Tale of Tom Kitten,,Beatrix Potter,333
The Great Illusion,,Norman Angell,333
Myths of the Norsemen: From the Eddas and Sagas,,H. A.  Guerber,333
The Little Red Hen,,,332
A Complete Dictionary of Synonyms and Antonyms,,Samuel Fallows,332
Dracula,,Bram Stoker,332
The symbolism of Freemasonry :,,Albert Gallatin Mackey,332
The Spanish Tragedie,,Thomas Kyd,332
Kant's Critique of Judgement,,Immanuel Kant,332
Hämähäkki ja muita kertomuksia,,Maila Talvio,331
The New Life,,Dante Alighieri,331
United States Steel: A Corporation with a Soul,,Arundel Cotter,331
Letters of Pliny,,the Younger Pliny,330
A Narrative of the Life of Mrs. Mary Jemison,,James E.  Seaver,329
The Velveteen Rabbit,,Margery Williams Bianco,329
The Letters of Jane Austen,,Jane Austen,329
The Arabian Nights: Their Best-known Tales,,,329
"The Odes of Casimire, Translated",,G. Hils by Maciej Kazimierz Sarbiewski,328
"The Mantle, and Other Stories",,Nikolai Vasilevich Gogol,328
New Atlantis,,Francis Bacon,328
Walking,,Henry David Thoreau,328
Divina Commedia di Dante: Inferno,,Dante Alighieri,328
Poems,,Rainer Maria Rilke,327
Plutarch: Lives of the noble Grecians and Romans,,Plutarch,327
Public Opinion,,Walter Lippmann,327
Boswell's Life of Johnson,,James Boswell,326
The Man Who Would Be King,,Rudyard Kipling,326
The New Gresham Encyclopedia. Estremoz to Felspar,,Various,326
"Napoleon's Letters to Josephine, 1796-1812",,Emperor of the French Napoleon I,326
Tartuffe,The Hypocrite,Molière,326
Venus in Furs,,Ritter von Leopold Sacher-Masoch,326
Niebla,,Miguel de Unamuno,325
The Secret Adversary,,Agatha Christie,325
In our time,,Ernest Hemingway,324
"Autobiography of Ma-ka-tai-me-she-kia-kiak, or Black Hawk",,Sauk chief Black Hawk,324
Yr Hwiangerddi,,Sir Owen Morgan Edwards,324
"Letters to His Son, Complete",,Earl of Philip Dormer Stanhope Chesterfield,324
The Taming of the Shrew,,William Shakespeare,323
The Will to Power: An Attempted Transvaluation of All Values. Book III and IV,,Nietzsche,323
Ghost Stories of an Antiquary,,M. R.  James,322
The Awakening of Spring: A Tragedy of Childhood,,Frank Wedekind,322
Some Principles of Maritime Strategy,,Julian Stafford Corbett,322
The Ancient Irish Epic Tale Táin Bó Cúalnge,,,321
The Marvelous Land of Oz,,L. Frank  Baum,321
"Legends, Tales and Poems",,Gustavo Adolfo Bécquer,320
The Secret of Chimneys,,Agatha Christie,319
Laughter: An Essay on the Meaning of the Comic,,Henri Bergson,318
Rilla of Ingleside,,L. M.  Montgomery,318
Dialogues in French and English,,William Caxton,317
Fables de La Fontaine,,Jean de La Fontaine,316
Maggie: A Girl of the Streets,,Stephen Crane,316
El libro de las tierras vírgenes,,Rudyard Kipling,316
"Amphitryo, Asinaria, Aulularia, Bacchides, Captivi",,Titus Maccius Plautus,316
O Pioneers!,,Willa Cather,315
Webster's Unabridged Dictionary,,Various,315
The Great Boer War,,Arthur Conan Doyle,315
King Solomon's Mines,,H. Rider  Haggard,314
Mr. Honey's Beginner's Dictionary,,Winfried Honig,314
Fairy and Folk Tales of the Irish Peasantry,,,314
The gardener,,Rabindranath Tagore,313
The Works of Horace,,Horace,313
"The Danish History, Books I-IX",,Grammaticus Saxo,313
Lady Susan,,Jane Austen,313
The Autobiography of Benjamin Franklin,,Benjamin Franklin,312
Constantinople,,Théophile Gautier,312
Father Goriot,,Honoré de Balzac,311
灵历集光,,Shangjie Song,311
Fifteen Thousand Useful Phrases,,Grenville Kleiser,311
The Notebooks of Leonardo Da Vinci — Complete,,da Vinci Leonardo,311
Bible animals :,,J. G.  Wood,310
The United States Constitution,,United States,310
"The Vision and Creed of Piers Ploughman, Volume 1",,William Langland,309
"Notes and Queries, Vol. III, Number 87, June 28, 1851",,Various,309
Siddhartha: eine indische Dichtung,,Hermann Hesse,309
"The Natural History of Pliny, Volume 1",,the Elder Pliny,309
She,,H. Rider  Haggard,309
Demian,,Hermann Hesse,309
The Battle with the Slum,,Jacob A.  Riis,308
The Power of Mesmerism,,Anonymous,308
How to Live on 24 Hours a Day,,Arnold Bennett,308
Four Arthurian Romances,,active 12th century de Troyes Chrétien,307
Roget's Thesaurus,,Peter Mark Roget,307
Monday or Tuesday,,Virginia Woolf,307
"Encyclopaedia Britannica, 11th Edition, ""Bent, James"" to ""Bibirine""",,Various,307
"Bushido, the Soul of Japan",,Inazo Nitobe,306
"Ancient Nahuatl Poetry, Containing the Nahuatl Text of XXVII Ancient Mexican Poems",,Brinton,306
The Convent School,Early Experiences of a Young Flagellant,Rosa Belinda Coote,306
Discourses on the First Decade of Titus Livius,,Niccolò Machiavelli,306
"Dhammapada, a Collection of Verses; Being One of the Canonical Books of the Buddhists",,,305
"The Bible, Douay-Rheims, Complete",,,305
Creative Chemistry: Descriptive of Recent Achievements in the Chemical Industries,,Slosson,304
"The Schoolmistress, and Other Stories",,Anton Pavlovich Chekhov,304
Das Kreuz im Venn :,,Clara Viebig,304
Lucian's True History,,of Samosata Lucian,304
The American Diary of a Japanese Girl,,Yoné Noguchi,303
The Pioneers,The Sources of the Susquehanna,James Fenimore Cooper,303
The Tragedy of Romeo and Juliet,,William Shakespeare,302
The Book of Tea,,Kakuzo Okakura,302
An Introduction to Mathematics,,Alfred North Whitehead,302
The Rime of the Ancient Mariner,,Samuel Taylor Coleridge,302
El Hombre Mediocre: Ensayo de psicologia y moral,,José Ingenieros,302
Kant's Prolegomena to Any Future Metaphysics,,Immanuel Kant,301
Nathan the Wise; a dramatic poem in five acts,,Gotthold Ephraim Lessing,301
Following the Equator: A Journey Around the World,,Mark Twain,301
"The History of Mary Prince, a West Indian Slave",,Mary Prince,301
Now we are six,,A. A.  Milne,301
"The passing of the great race; or, The racial basis of European history",,Madison Grant,301
The Birds,,Aristophanes,301
The Imaginary Invalid,,Molière,301
Men without women,,Ernest Hemingway,300
Surgical Anatomy,,Joseph Maclise,300
The Book of Household Management,,Mrs.  Beeton,300
Faust: Der Tragödie erster Teil,,Johann Wolfgang von Goethe,299
"The Essays or Counsels, Civil and Moral",,Francis Bacon,299
Letters of Two Brides,,Honoré de Balzac,298
Buddenbrooks: Verfall einer Familie,,Thomas Mann,297
The Fortunes and Misfortunes of the Famous Moll Flanders,,Daniel Defoe,297
The First Blast of the Trumpet against the monstrous regiment of Women,,John Knox,297
Babbitt,,Sinclair Lewis,297
Outline of the history of the English language and literature,,Anonymous,297
The United States Bill of Rights,,United States,297
The Piazza Tales,,Herman Melville,296
"How to Tell a Story, and Other Essays",,Mark Twain,295
"Ragged Dick,",Street Life in New York with the Boot-Blacks,Jr. Horatio Alger,295
"Obras Completas de Luis de Camões, Tomo II",,Luís de Camões,295
Pictures from Italy,,Charles Dickens,295
The Dawn of Day,,Friedrich Wilhelm Nietzsche,294
The Wonders of the Invisible World,,Cotton Mather and Increase Mather,294
At the mountains of madness,,H. P.  Lovecraft,294
Memoirs of General William T. Sherman — Complete,,William T.  Sherman,293
Nostromo: A Tale of the Seaboard,,Joseph Conrad,292
The Outline of History: Being a Plain History of Life and Mankind,,H. G.  Wells,292
My Reminiscences,,Rabindranath Tagore,291
The Financier: A Novel,,Theodore Dreiser,291
"The Histories of Polybius, Vol. 1",,Polybius,290
"Current History, Vol. VIII, No. 3, June 1918",,Various,290
"The Life of St. Teresa of Jesus, of the Order of Our Lady of Carmel",,Saint of Avila Teresa,289
The Varieties of Religious Experience: A Study in Human Nature,,William James,289
The Uncommercial Traveller,,Charles Dickens,289
An Old Babylonian Version of the Gilgamesh Epic,,Albert Tobias Clay and Morris Jastrow,289
Little Lord Fauntleroy,,Frances Hodgson Burnett,288
"""The Kingdom of God Is Within You""",,graf Leo Tolstoy,288
"Shakespeare, William",,,54727
"Shelley, Mary Wollstonecraft",,,42575
"Dickens, Charles",,,37403
"Smollett, T.",,,30402
"Twain, Mark",,,29041
"Austen, Jane",,,29007
"Wilde, Oscar",,,23979
"Dostoyevsky, Fyodor",,,22525
"Dumas, Alexandre",,,21383
"Melville, Herman",,,21075
"Doyle, Arthur Conan",,,20837
"Hawthorne, Nathaniel",,,19145
"Nietzsche, Friedrich Wilhelm",,,19022
"Garnett, Constance",,,18909
"Montgomery, L. M.",,,18372
"Maquet, Auguste",,,18008
"Alcott, Louisa May",,,17978
"Carroll, Lewis",,,17652
"Stevenson, Robert Louis",,,16717
"Eliot, George",,,15968
Plato,,,15760
"Forster, E. M.",,,14581
"Jowett, Benjamin",,,14433
Homer,,,13538
"Merrill, Frank T.",,,13171
"Wells, H. G.",,,13145
"Ibsen, Henrik",,,13047
"Foote, Mary Hallock",,,12724
"Ipsen, Ludvig Sandöe",,,12573
"Anthony, A. V. S.",,,12573
"Widger, David",,,12462
"Poe, Edgar Allan",,,12343
"Gaskell, Elizabeth Cleghorn",,,12328
"Irving, Washington",,,11944
"Tolstoy, Leo, graf",,,11604
"Rizal, José",,,11512
"Von Arnim, Elizabeth",,,11118
"Fielding, Henry",,,10907
"Hugo, Victor",,,10861
"Kafka, Franz",,,10737
"Wagner, Richard",,,10566
"Swift, Jonathan",,,10523
"Brock, C. E.",,,10426
"Cervantes Saavedra, Miguel de",,,10291
